{
  "evidence_ids": [
    "ev-psychoanalysis-s7-adler-separation"
  ],
  "id": "individual-psychology-contrasts-with-psychoanalysis",
  "object_id": "psychoanalysis",
  "provenance": "source_derived",
  "publishable": true,
  "record_type": "relation",
  "relation_type": "contrasts_with",
  "scope_note": "Contrast records Adler's departure after disagreements and subsequent naming of his theory. It does not claim that Individual Psychology is a continuing internal branch or rejects every idea associated with psychoanalysis.",
  "status": "verified",
  "subject_id": "individual-psychology"
}
