{"evidence_ids":["ev-indigenous-psychology-s7-cross-cultural-branch"],"id":"indigenous-psychology-branch-of-cross-cultural-psychology","object_id":"cross-cultural-psychology","provenance":"source_derived","publishable":true,"record_type":"relation","relation_type":"branch_of","scope_note":"This is the disciplinary placement stated by Georgas and Mylonas in the 2006 volume. It does not assert identity, exclusivity, or universal agreement about field boundaries.","status":"verified","subject_id":"indigenous-psychology"}
