{"evidence_ids":["ev-cbt-s2-named-cognitive-therapy","ev-cbt-s2-gradual-integration-1970s"],"id":"cognitive-therapy-influenced-cbt","object_id":"cbt","provenance":"source_derived","publishable":true,"record_type":"relation","relation_type":"influenced","scope_note":"The relation records one documented stream in CBT's gradual formation; it does not identify Cognitive Therapy with the entire CBT family.","status":"verified","subject_id":"cognitive-therapy"}
